{
  "changed_views": [
    "The panel challenges the assumption that slower frontier progress automatically means less GPU demand: safety overhead and supply constraints could preserve utilization while capability growth slows.",
    "Nanos revises his initial reading of pacing after Kan distinguishes continued training from delayed future training runs."
  ],
  "entities": [
    "SemiAnalysis",
    "Jordan Nanos",
    "Max Kan",
    "Doug O'Laughlin",
    "Joey Brookhart",
    "OpenAI",
    "Anthropic",
    "Nvidia",
    "METR",
    "Hugging Face",
    "Moonshot AI"
  ],
  "follow_ups": [
    "Check delivered capacity, signed GPU contract prices, and utilization separately from lab model-release cadence and long-range revenue forecasts.",
    "Check measured monitoring overhead and actual evaluator access terms for infrastructure coverage and incident-response authority.",
    "Seek Moonshot\u2019s response and independent endpoint evidence before treating Anthropic\u2019s attribution as independently established."
  ],
  "relevance_score": 5,
  "signals": [
    {
      "category": "semiconductors_compute",
      "claim": "The panel reports much higher GB300 pricing for immediate availability than for capacity starting six months later, and suggests buyers might accept a 20\u201330% premium over a three-year contract to start two or three months earlier.",
      "confidence": "medium",
      "evidence": "A panelist describes a fresh provider quote and a supplier able to wait until installation to test pricing. The premium is a proposed buyer tradeoff; the underlying dollar quote is omitted from the captions and no completed transaction is established.",
      "kind": "inference",
      "timestamp": "06:02"
    },
    {
      "category": "infrastructure_energy",
      "claim": "Max Kan expects compute demand to exceed physically deliverable supply for the next two to three years even with pacing, because alignment research, monitoring, and RL-environment quality checks consume substantial compute.",
      "confidence": "medium",
      "evidence": "Kan cites agent-based checking of vendor RL environments and the cost of monitoring. OpenAI\u2019s [August 18 disclosure](https://openai.com/index/pacing-model-development-cyber-capabilities/) independently confirms its estimate of roughly 20% overhead relative to the inference compute being monitored, varying substantially by workload. That is not 20% of all lab compute, nor proof that safety demand offsets any possible training slowdown.",
      "kind": "forecast",
      "timestamp": "13:11"
    },
    {
      "category": "policy_geopolitics_security",
      "claim": "Jordan Nanos argues that independent AI audits need access to the operational stack as well as model behavior: credentials, schedulers, fleet access, monitoring ownership, and intervention mechanisms can determine whether an agent escape becomes a large incident.",
      "confidence": "medium",
      "evidence": "Nanos lists unanswered infrastructure questions and recounts a Black Hat disclosure of an agent exploiting a public CVE on an unpatched internal host. He explicitly says public details are insufficient, so his account does not establish the full incident scope.",
      "kind": "inference",
      "timestamp": "22:03"
    },
    {
      "category": "agents_developer_tools",
      "claim": "Nanos says an Anthropic threat report alleged that Moonshot served Claude behind its API and collected exchanges for training, raising a model-provenance and data-routing concern for customers and benchmark users.",
      "confidence": "low",
      "evidence": "Nanos attributes the allegation to Anthropic. Its [September threat report](https://www.anthropic.com/threat-intelligence-report-september-2026) does allege customer-request relaying and saved exchanges for training, including almost 300,000 relayed requests in one ten-day period. This verifies what Anthropic alleged, not the underlying conduct independently; the discussion\u2019s benchmark and privacy implications remain conditional on that allegation.",
      "kind": "observation",
      "timestamp": "30:52"
    },
    {
      "category": "frontier_labs_models",
      "claim": "Max Kan interprets pacing as delaying future training runs until labs understand and control existing models better, and forecasts weaker internal frontier models by end-2027 than under the previous trajectory.",
      "confidence": "medium",
      "evidence": "After a disagreement over whether pacing means stopping training, Kan distinguishes a full halt from delayed runs and lower counterfactual capability. Nanos accepts that distinction. This is the panel's interpretation, not an announced training schedule.",
      "kind": "forecast",
      "timestamp": "43:23"
    }
  ],
  "skip_reason": "",
  "summary": "The SemiAnalysis panel argues that pacing frontier development can reduce future capability growth without reducing near-term compute purchases. Max Kan expects physical supply to remain below demand and safety work to absorb substantial compute; Jordan Nanos emphasizes infrastructure controls and model-provider provenance as underexamined security problems. These are the panel's interpretations and forecasts, not new lab purchasing commitments.",
  "why_it_matters": "Separating model progress, lab revenue expectations, and GPU utilization changes how to interpret a safety slowdown. The discussion also identifies operational security spending and verifiable model sourcing as potential requirements for AI infrastructure and application providers."
}
