{
  "changed_views": [
    "Agent traffic has crossed from future planning assumption to current web-infrastructure load, at least in Cloudflare's view of the internet.",
    "Cloudflare's AI infrastructure thesis is not just edge inference; it combines isolate-based execution, agent-optimized content formats, distributed data-center economics, and AI-native internal operations.",
    "Early-career hiring may become an AI adoption advantage for infrastructure companies rather than a headcount category to cut."
  ],
  "entities": [
    "Cloudflare",
    "Matthew Prince",
    "Void Zero",
    "Vite",
    "Cloudflare Workers",
    "OpenAI",
    "NVIDIA",
    "Apple",
    "Cloudflare OS"
  ],
  "follow_ups": [
    "Track Cloudflare disclosures on agent traffic mix, Workers AI revenue, and utilization of edge GPUs.",
    "Watch whether AI labs continue to target Cloudflare Workers as a default runtime for generated code.",
    "Compare Cloudflare's markdown-for-agents content path with emerging MCP, llms.txt, and agent-readable web standards."
  ],
  "relevance_score": 5,
  "signals": [
    {
      "category": "agents_developer_tools",
      "claim": "Prince says Cloudflare bought Void Zero because Vite is becoming part of the agent-development platform layer.",
      "confidence": "high",
      "evidence": "He says Vite has about 130 million weekly downloads, will remain open source, and will be integrated so Cloudflare is the best place to run Vite projects while still supporting other platforms.",
      "kind": "observation",
      "timestamp": ""
    },
    {
      "category": "infrastructure_energy",
      "claim": "Prince says container-based agent execution would exhaust implausible amounts of global CPU capacity.",
      "confidence": "high",
      "evidence": "He estimates one containerized agent for each of 100 million US knowledge workers would require about half of all CPU capacity produced today, and global deployment would be tens of times larger than existing CPU and GPU capacity.",
      "kind": "forecast",
      "timestamp": ""
    },
    {
      "category": "applications_business_models",
      "claim": "Prince says bot and agent traffic passed human web traffic in the first half of 2026, far earlier than he expected.",
      "confidence": "high",
      "evidence": "He says he originally expected the crossover by late 2027, revised to first half 2027, but Cloudflare saw it happen in first half 2026 after years of bot traffic sitting near 20%.",
      "kind": "observation",
      "timestamp": ""
    },
    {
      "category": "applications_business_models",
      "claim": "Prince says agent traffic could reach 1,000 times human web traffic within five years.",
      "confidence": "medium",
      "evidence": "He argues agents have boundless attention and may visit thousands of sites for tasks where a human would visit a handful, driving much larger internet consumption.",
      "kind": "forecast",
      "timestamp": ""
    },
    {
      "category": "agents_developer_tools",
      "claim": "Prince says Cloudflare is converting customer sites into markdown for agent consumption.",
      "confidence": "high",
      "evidence": "He says markdown removes human-oriented HTML cruft, saves tokens and processing, and lets agent context windows hold more useful information.",
      "kind": "observation",
      "timestamp": ""
    },
    {
      "category": "infrastructure_energy",
      "claim": "Prince says Cloudflare's edge inference thesis has shifted toward long-running handoffs from devices to the network.",
      "confidence": "medium",
      "evidence": "He says Cloudflare now runs inference at the edge across more than 350 cities, but he expects less than his prior 50% on-device assumption because many agent tasks will run for minutes, hours, or days.",
      "kind": "forecast",
      "timestamp": ""
    },
    {
      "category": "companies_capital_allocation",
      "claim": "Prince says Cloudflare is betting heavily on AI-native young talent while many companies cut early-career hiring.",
      "confidence": "high",
      "evidence": "He says Cloudflare has just under 5,000 employees and hired 1,111 interns this summer; the interns are teaching employees how to use AI tools effectively.",
      "kind": "observation",
      "timestamp": ""
    }
  ],
  "skip_reason": "",
  "summary": "Cloudflare CEO Matthew Prince argues that agents are already forcing a new internet architecture. He says bot and agent traffic crossed human web traffic in the first half of 2026, traditional containers are too heavy for mass agent execution, Workers isolates are a better runtime, Cloudflare is translating web content into markdown for agents, and edge inference will serve long-running tasks handed off from devices.",
  "why_it_matters": "This is a first-party infrastructure view from one of the few companies with broad internet telemetry. It reframes agent adoption as an immediate CPU, bandwidth, content-format, runtime, and organizational-design problem rather than a speculative application-layer trend."
}
