{
  "changed_views": [
    "AI adoption at Netflix is not simply reinforcing decentralization: higher local velocity and cross-system agents are increasing the value of centralized infrastructure, paved paths, and encoded controls.",
    "Netflix is not responding to AI by eliminating junior hiring or functional craft; it is pairing universal AI fluency with continued specialization, mentorship, and explicit human accountability."
  ],
  "entities": [
    "Netflix",
    "Elizabeth Stone",
    "InterPositive",
    "Ben Affleck"
  ],
  "follow_ups": [
    "Track Netflix engineering posts and job listings for concrete architecture behind agent identity, source-of-truth data, shared paved paths, and the shift toward distributed-systems hiring.",
    "Verify which productions use InterPositive or other generative post-production tools, and whether Netflix reports cost, cycle-time, quality, or localization gains.",
    "Watch whether Netflix's AI-fluency overlay becomes a measured performance criterion and whether the company publishes adoption or quality metrics beyond qualitative examples."
  ],
  "relevance_score": 4,
  "signals": [
    {
      "category": "agents_developer_tools",
      "claim": "Stone says Netflix is strengthening common infrastructure and hiring more distributed-systems and infrastructure engineers because agents operating across many systems make shared paved paths, source-of-truth data, and guardrails more important.",
      "confidence": "high",
      "evidence": "She contrasts Netflix's historically local, team-specific stacks with a new need to solve common capabilities once across the business; she says the shift is additive rather than a wholesale removal of domain experts.",
      "kind": "observation",
      "timestamp": "13:53"
    },
    {
      "category": "applications_business_models",
      "claim": "Stone says Netflix is deploying AI across creative ideation, previsualization, post-production, localization, trailers, and promotional artwork, with multiple productions already using a mix of internal and vendor tools.",
      "confidence": "high",
      "evidence": "She highlights the acquisition of InterPositive, whose capabilities can relight, reframe, reshoot, or alter dialogue after filming under creator direction, and says the same tool chain can extend into advertising and marketing.",
      "kind": "observation",
      "timestamp": "32:05"
    },
    {
      "category": "companies_capital_allocation",
      "claim": "Stone says Netflix has made AI fluency a universal overlay across roles and seniority levels rather than embedding a fixed AI rubric in each career level, and now permits AI tools in coding interviews.",
      "confidence": "high",
      "evidence": "The expectation covers knowing where AI is and is not useful, exercising judgment, and experimenting; Netflix also probes AI use and adaptability in interviews, including at senior leadership levels.",
      "kind": "observation",
      "timestamp": "28:58"
    },
    {
      "category": "applications_business_models",
      "claim": "Stone says AI now lets product, design, data-science, finance, content, and advertising teams generate hypotheses and prototypes earlier by synthesizing Netflix's decades of experiments, consumer research, and business knowledge.",
      "confidence": "high",
      "evidence": "She describes near-instant retrieval and distillation of prior tests and insights as a head start, while requiring source-of-truth data and validation by domain experts rather than treating model output as authoritative.",
      "kind": "observation",
      "timestamp": "08:12"
    },
    {
      "category": "agents_developer_tools",
      "claim": "Netflix expects many agents to contribute directly to work, while humans retain responsibility for selecting problems and judging whether outputs are useful and high quality.",
      "confidence": "high",
      "evidence": "Stone says work will be performed by both humans and agents, and identifies access, identity, security, testing, review, and human accountability as controls needed to contain the resulting risk.",
      "kind": "forecast",
      "timestamp": "19:38"
    },
    {
      "category": "companies_capital_allocation",
      "claim": "Stone says Netflix is continuing its intern and new-graduate programs despite AI automation, treating junior talent as strategically important while increasing the burden on mentorship, review, testing, and craft mastery.",
      "confidence": "high",
      "evidence": "Netflix only began hiring straight from undergraduate and graduate programs a few years ago; Stone argues early-career hires add AI-native behavior and changing-consumer context but must still learn to own production quality.",
      "kind": "observation",
      "timestamp": "53:39"
    }
  ],
  "skip_reason": "",
  "summary": "Netflix CPTO Elizabeth Stone describes AI as an organizational and architectural shift, not just a coding-productivity tool. Netflix is hiring more distributed-systems, infrastructure, and systems-thinking talent; building shared paved paths and guardrails for human-and-agent work; making AI fluency a universal career and hiring expectation; and applying AI to internal knowledge retrieval and content production. The episode offers concrete operating choices but few metrics, so the adoption claims remain qualitative.",
  "why_it_matters": "Netflix is a useful scaled-enterprise case: more AI-enabled local velocity is pushing a historically decentralized engineering culture toward stronger common infrastructure, source-of-truth data, identity, security, and quality controls. Its content-production deployments and InterPositive acquisition also show that application-layer value is extending beyond software development into the media production stack."
}
