{
  "changed_views": [
    "Cursor is no longer a standalone coding vendor: SpaceX ownership directly links its distribution to a large GPU fleet and internal model development, although the transaction terms remain unverified here.",
    "Anthropic's formal organization may not capture all influence around CEO decisions; the cited reporting points to an informal external adviser with meaningful investor and political access.",
    "South Korea provides a live example of retail leverage accelerating an AI-semiconductor equity boom and prompting intervention only after large losses.",
    "Agent observability vendors are making detection of unanticipated failures a separate product layer above predefined alerts and evals, but Lemma's efficacy remains unproven in this episode.",
    "AI coding may collapse feature-replication cost faster than product distribution: TBPN says its Slack-like clone looked credible and added video calling, yet adoption and churn ended the experiment.",
    "Thrive is no longer only a private-market AI investor; the cited filing shows a material public book spanning SpaceX, Amazon, Oscar Health, Shopify, and Figma."
  ],
  "entities": [
    "Cursor",
    "Michael Truell",
    "OpenAI Startup Fund",
    "Anthropic",
    "Dario Amodei",
    "Cami Clark",
    "Eric Schmidt",
    "Lemma",
    "Jerry Zhang",
    "South Korea",
    "Samsung Electronics",
    "SK Hynix",
    "Thrive Capital",
    "Amazon",
    "Oscar Health",
    "Shopify",
    "Figma",
    "Slack",
    "SpaceX"
  ],
  "follow_ups": [
    "Review regulatory filings or transaction documents for Cursor's consideration, structure, retention terms, and investor proceeds, and track whether SpaceX compute measurably lowers Cursor model costs.",
    "Read the cited Wall Street Journal and Information reporting plus Anthropic governance disclosures to separate sourced facts from host commentary and test the IPO scenario.",
    "Confirm South Korea's leveraged-ETF training rule, market figures, and effective date with the financial regulator or exchange.",
    "Request Lemma customer evidence, evaluation methodology, false-positive rates, and examples of failures found without predefined rules.",
    "Review Thrive's primary securities filing to confirm position values, reporting dates, and whether the SpaceX holding sits in a public or crossover vehicle.",
    "Track whether rapid AI-built feature parity changes collaboration-software switching, retention, and distribution economics rather than only development cost."
  ],
  "relevance_score": 4,
  "signals": [
    {
      "category": "companies_capital_allocation",
      "claim": "Cursor's same-day official post confirms that SpaceX acquired the company; a TBPN host said Michael Truell had announced the deal's close, while Cursor says SpaceX GPU access should enable stronger models that are cheaper to run.",
      "confidence": "high",
      "evidence": "At this timestamp the host cited Truell's closing announcement and discussed the deal as an exceptional venture outcome. Cursor's primary post confirms the buyer and says the combination provides access to SpaceX's GPU fleet for more capable, lower-cost models; neither source here establishes verified transaction terms.",
      "kind": "observation",
      "timestamp": "01:14:33"
    },
    {
      "category": "companies_capital_allocation",
      "claim": "A TBPN host quoted a Wall Street Journal scenario in which Anthropic could pursue an IPO as soon as the fall at a valuation as high as $2 trillion.",
      "confidence": "low",
      "evidence": "The timing and valuation appeared as possibilities in the article summarized on-air, not as an Anthropic announcement, so they are a capital-markets scenario rather than confirmed transaction terms.",
      "kind": "forecast",
      "timestamp": "00:20:14"
    },
    {
      "category": "companies_capital_allocation",
      "claim": "A TBPN host, relaying Wall Street Journal and Information reporting, said Cami Clark is not an Anthropic employee but acts as Dario Amodei's strategic sounding board, introduced Eric Schmidt as an early investor, and engages investors and political figures around Amodei.",
      "confidence": "medium",
      "evidence": "The host said the reporting placed Clark at investor conferences and described an attempted fund that would have formalized her Anthropic involvement and managed Schmidt's investment; other cofounders reportedly did not support that structure, and no Anthropic confirmation was presented.",
      "kind": "observation",
      "timestamp": "00:18:10; 00:21:25; 00:22:09"
    },
    {
      "category": "policy_geopolitics_security",
      "claim": "A TBPN host reported that South Korea now requires new users of single-stock leveraged ETFs to complete one hour of simulated trading daily for five days after substantial losses in products tied to Samsung Electronics and SK Hynix.",
      "confidence": "medium",
      "evidence": "The on-air account said the KOSPI rose 76% in 2025 and doubled again before a 22% July correction; investors who bought leveraged chip ETFs in late May and held to mid-July lost about half, while daily turnover later fell from 12 trillion won to 70 billion won.",
      "kind": "observation",
      "timestamp": "00:32:04; 00:34:10; 00:36:57"
    },
    {
      "category": "agents_developer_tools",
      "claim": "Lemma founder Jerry Zhang positioned the product as contextual monitoring for longer-running agents that can surface failure modes teams did not predefine, rather than relying only on fixed alerts or judges.",
      "confidence": "medium",
      "evidence": "A host paraphrased Zhang's launch argument and used anomalous mass-emailing and commerce activity as examples; the episode provided no customer results, false-positive rates, or measured detection performance.",
      "kind": "observation",
      "timestamp": "00:06:28"
    },
    {
      "category": "companies_capital_allocation",
      "claim": "A securities filing summarized on TBPN indicates Thrive's public-market strategy had reached multi-billion-dollar scale, led by a reported $3.2 billion SpaceX position and $250 million Amazon stake.",
      "confidence": "medium",
      "evidence": "Citing Bloomberg and the filing, a host also listed about $180 million of Oscar Health plus positions in Shopify and Figma, and said Thrive had trimmed Carvana and StubHub.",
      "kind": "observation",
      "timestamp": "01:27:53; 01:28:20"
    },
    {
      "category": "applications_business_models",
      "claim": "TBPN's in-house Slack-clone test suggests AI coding can rapidly reproduce rich collaboration-product functionality without removing the adoption and retention moat.",
      "confidence": "medium",
      "evidence": "The hosts say they one-shot or vibe-coded a Slack-like app that looked polished and included video calling, but abandoned it after difficult adoption and high churn.",
      "kind": "inference",
      "timestamp": "01:32:16; 01:32:21"
    }
  ],
  "skip_reason": "",
  "summary": "A broad news episode with several consequential items: Cursor's same-day official post confirms that SpaceX acquired the coding company, pairing its application layer with SpaceX compute to pursue stronger, cheaper-to-run models; the hosts relayed a possible $2 trillion Anthropic IPO scenario and reporting about informal influence around its CEO; detailed South Korea's intervention after leveraged semiconductor-ETF losses; presented Lemma's approach to monitoring unanticipated agent failures; reported Thrive's multi-billion-dollar public-market book; and offered a first-hand Slack-clone experiment showing that rapid feature replication did not solve adoption or retention. The Anthropic scenario, Lemma's efficacy, regulatory figures, and Cursor transaction terms still require further primary verification.",
  "why_it_matters": "SpaceX's acquisition of Cursor vertically links scarce GPU capacity, model development, and a major coding-agent distribution surface; Cursor explicitly expects the compute access to improve capability and reduce model operating cost. Anthropic's possible IPO and informal decision-making network bear directly on governance, capital formation, and political access at a frontier lab. South Korea offers a concrete example of retail leverage amplifying an AI-semiconductor boom before regulators intervened. TBPN's Slack experiment suggests coding agents may commoditize feature production faster than distribution and retention, while Thrive's reported holdings show a venture manager deploying multi-billion-dollar public capital into AI beneficiaries. Lemma points to an emerging agent-observability layer, but the episode supplies no efficacy data."
}
