{
  "changed_views": [
    "Code review independence has a concrete buyer rationale beyond feature quality: firms using several coding agents may want validation under a separate vendor. Gupta's NVIDIA example strengthens that demand thesis without proving Greptile's long-term defensibility.",
    "Individual coding speed and token consumption are weak substitutes for delivered product value. Gupta's observations make validation and outcome measurement plausible bottlenecks, but do not establish that aggregate productivity gains are absent.",
    "An assistant's operating boundary may matter as much as its model: Town separates fast text requests from team projects and approvals, while Tolan allocates substantial effort to selective memory and context-sensitive follow-up.",
    "Game-generation demos should be evaluated separately from the design and balancing of new games. Board Game Lab's human-provided pattern is a useful concrete boundary on the broader automation story."
  ],
  "entities": [
    "Greptile",
    "Daksh Gupta",
    "NVIDIA",
    "Menlo Ventures",
    "Town",
    "Jean-Denis Greze",
    "Forerunner Ventures",
    "Tolan",
    "Quinten Farmer",
    "OpenAI",
    "Bing Gordon",
    "Board Game Lab"
  ],
  "follow_ups": [
    "Track whether Greptile ships the spend-observability work discussed here, and look for measured accepted changes, escaped defects, review time and business outcomes per dollar across agent vendors.",
    "Look for a published NVIDIA customer account that confirms the scope and results of Greptile deployment; the interview supplies Gupta's account of the purchasing rationale.",
    "When Town launches its proactive home base, assess false-positive recommendations, missed important events, approval behavior and compute cost per useful action; keep those results separate from today's prompted summaries and discovery tab.",
    "Look for current Tolan cohort or controlled test data separating model upgrades from memory changes, along with serving costs; the interview provides directional engagement claims only.",
    "Track Board Game Lab's transition from implementing established solitaire rules to novel multiplayer designs, including evidence on balancing quality and human iteration time."
  ],
  "relevance_score": 4,
  "signals": [
    {
      "category": "agents_developer_tools",
      "claim": "Greptile's Daksh Gupta says enterprises increasingly want one independent validator across competing coding agents, with NVIDIA an early example of that demand.",
      "confidence": "medium",
      "evidence": "Gupta says Greptile initially expected independence to matter to a narrow customer segment, but heard much broader demand. He identifies NVIDIA as its first large customer and says it wanted validation separated from the providers writing code. He also announces a $50 million Menlo-led Series B, corroborated by [Greptile's October 19 announcement](https://www.greptile.com/blog/series-b). The customer rationale is Gupta's account; the company's aim to review and test every change is not a demonstrated guarantee that every merge is safe.",
      "kind": "observation",
      "timestamp": "01:47:41; 01:49:57; 01:50:37"
    },
    {
      "category": "agents_developer_tools",
      "claim": "Town's Jean-Denis Greze describes a work-assistant design built around employer-controlled data boundaries, persistent team threads and explicit approvals for privileged tasks.",
      "confidence": "high",
      "evidence": "Greze says customers differ on whether personal accounts may connect to a work assistant, so the business should choose that boundary. Quick requests can arrive by text or email, while longer projects get dedicated threads involving coworkers and their Townies. In his own admin channel, employees request changes and his assistant asks him before using his administrator rights. [Town's October 19 release](https://www.town.com/press/series-b) confirms its $108 million round at a $1 billion valuation and the team-coordination focus; [its safety documentation](https://www.town.com/docs/safety) describes approval defaults and scoped preauthorization. This supports a governed workflow design, not proof of flawless permission enforcement.",
      "kind": "observation",
      "timestamp": "01:55:50; 01:58:06; 02:00:41; 02:01:16"
    },
    {
      "category": "agents_developer_tools",
      "claim": "Tolan's Quinten Farmer says selective memory takes most engineering effort, while model and background-agent upgrades continue to improve engagement.",
      "confidence": "medium",
      "evidence": "Farmer says human-like recall requires forgetting incidental details as well as retaining important ones. He reports increased engagement and perceived value after model or background-agent upgrades, without supplying effect sizes or controlled comparisons. [OpenAI's January 7, 2026 Tolan case study](https://openai.com/index/tolan/) describes an earlier implementation with turn-level memory retrieval and nightly pruning, which supports the architectural account but is not a current retention measurement. Farmer also says proactive help should follow something a user shared, with a light check-in before substantive work.",
      "kind": "observation",
      "timestamp": "02:11:41; 02:12:10; 02:15:37; 02:16:39"
    },
    {
      "category": "applications_business_models",
      "claim": "Gupta says Greptile is building better coding-agent spend measurement because claimed individual productivity gains are not yet clearly visible in large-company software outcomes.",
      "confidence": "medium",
      "evidence": "He says spend evaluation is being worked on now and contrasts the scrutiny applied to hiring with relatively casual increases in token budgets. He observes that reported personal productivity gains have not translated into an equally obvious expansion in large companies' software quality or quantity, while acknowledging that startups can operate with smaller teams. His separate mechanism is that users tolerate bugs per unit of time, so faster code changes require lower defect rates per change. These are operator observations and a product direction, not a measured industry-wide ROI result or an announced generally available analytics product.",
      "kind": "observation",
      "timestamp": "01:51:13; 01:52:22; 01:52:58; 01:54:10"
    },
    {
      "category": "applications_business_models",
      "claim": "Greze says proactive assistants face a combined compute, timing and trust problem: useful recommendations require research before the user asks, but low-quality interruptions can erase the benefit.",
      "confidence": "medium",
      "evidence": "He distinguishes current user-requested Slack summaries from a proactive home base still coming soon. He says Town already uses a discovery surface, is spending more compute on important areas, and must choose when suggestions appear. He acknowledges both valuable customer outcomes and recommendations that miss. The proposed supplier savings and revenue opportunities are examples, not measured customer results; the general point is his product judgment that background research and selective delivery matter as much as generating suggestions.",
      "kind": "opinion",
      "timestamp": "02:03:09; 02:06:01; 02:06:46; 02:07:52; 02:08:18"
    },
    {
      "category": "applications_business_models",
      "claim": "Bing Gordon argues that AI can remove game-production chores and accelerate iteration, while system design, mathematical balance and coherent player progression remain the harder work.",
      "confidence": "medium",
      "evidence": "Gordon describes working with Board Game Lab and says generated dialogue is not enough unless it connects to mechanics that players care about. He recounts the time needed to tune card-game systems and says some mostly agentic companies he works with took roughly a year longer than expected to turn drafts into good products; the sample is unspecified. As a concrete external check, [Board Game Lab's October 8 post](https://www.boardgamelab.com/blog/klondike-coded-entirely-by-ai/) says AI implemented Klondike without code inspection after a human-built FreeCell pattern. That supports bounded implementation progress, not autonomous invention or balancing of a novel commercial game.",
      "kind": "opinion",
      "timestamp": "01:32:21; 01:35:05; 01:36:08; 01:39:41; 01:40:34"
    }
  ],
  "skip_reason": "",
  "summary": "TBPN's October 19 interviews provide a useful check on where AI application value is moving beyond raw generation. Greptile founder Daksh Gupta describes enterprise demand for code validation independent of whichever agents write the code, while acknowledging that higher token spending still needs better measurement against shipped outcomes. Town CEO Jean-Denis Greze describes work assistants organized around team permissions, project threads and human approvals, and says proactive recommendations still miss often enough to damage trust. Tolan founder Quinten Farmer says selective memory consumes most of its engineering effort even as model upgrades continue to improve engagement. Bing Gordon supplies a complementary gaming perspective: cheaper asset generation and faster prototypes do not remove the work of designing and balancing a compelling game.",
  "why_it_matters": "The clearest application opportunities are in validation, permission-aware collaboration, memory and deciding when an agent should act. These interviews also expose the remaining costs: proving that token spend improves software outcomes, funding useful background research without flooding users with weak suggestions, and converting generated content into coherent products. The implications are strongest as founder and operator observations; the episode does not provide controlled productivity studies, independently audited ROI or evidence that any vendor can guarantee safe autonomous execution."
}
