{
  "changed_views": [
    "The current AI hardware bottleneck may have shifted from power and advanced packaging toward leading-edge front-end wafer capacity.",
    "N3 allocation and HBM procurement now look like strategic moats for accelerator customers, not just supply-chain execution details.",
    "Older GPUs may deserve longer useful-life assumptions if H100s are being renewed into 2030.",
    "CPO timing and scope remain highly dependent on NVIDIA engineering choices, especially whether deployment is limited to inter-rack links or expands inside racks."
  ],
  "entities": [
    "TSMC",
    "NVIDIA",
    "AMD",
    "Google",
    "Amazon",
    "OpenAI",
    "Anthropic",
    "Apple",
    "Qualcomm",
    "MediaTek",
    "Samsung",
    "SK Hynix",
    "Micron",
    "CoreWeave",
    "Lumentum"
  ],
  "follow_ups": [
    "Recover or verify the intended DG Matrix 800V DC transcript because the supplied transcript appears to be a different SemiAnalysis Weekly episode.",
    "Track TSMC's actual 2026 and 2027 capex and whether N2 migration relieves enough N3 capacity for accelerators.",
    "Watch GB300 rental-market pricing and 1-4 year contract looseness as the key test of whether new inference supply catches demand.",
    "Monitor HBM4 and HBM4E vendor qualification against NVIDIA's pin-speed targets.",
    "Follow NVIDIA CPO deployment details for NVO 576 and NVO 1152, especially whether optics are used within racks or mainly between racks."
  ],
  "relevance_score": 5,
  "signals": [
    {
      "category": "semiconductors_compute",
      "claim": "The SemiAnalysis speakers argue that AI accelerator demand is overwhelming TSMC N3 capacity.",
      "confidence": "high",
      "evidence": "They model AI rising from 9% of 3 nm wafer demand in 2025 to about 60% in 2026 and 85-90% in 2027 as Rubin, MI400, TPU v7/v8, and Trainium ramp.",
      "kind": "forecast",
      "timestamp": "10:24"
    },
    {
      "category": "semiconductors_compute",
      "claim": "Shravan says TSMC capex increases will not provide near-term relief.",
      "confidence": "high",
      "evidence": "He cites TSMC moving from roughly $30 billion in recent annual capex to a $52-54 billion guide, expects closer to $70 billion in 2027, and says new capacity still takes 12-24 months.",
      "kind": "forecast",
      "timestamp": "04:39"
    },
    {
      "category": "semiconductors_compute",
      "claim": "The speakers say consumer-device weakness is not a large enough release valve for accelerator supply.",
      "confidence": "high",
      "evidence": "Their modeling says reallocating 5% of 2026 N3 smartphone wafers yields only slightly above 100,000 Rubin GPUs or 300,000 TPU v7s; even 25% reallocation yields about 700,000 Rubin GPUs and 1.5 million TPU v7s.",
      "kind": "observation",
      "timestamp": "16:21"
    },
    {
      "category": "semiconductors_compute",
      "claim": "The speakers frame HBM tightness as structural through at least the second half of 2027.",
      "confidence": "high",
      "evidence": "They say HBM consumes about 3x the wafer capacity per bit of commodity DRAM, HBM4/4E can rise to 4x, and some vendors struggle to meet NVIDIA's requested 11 Gbps pin speeds.",
      "kind": "forecast",
      "timestamp": "17:26"
    },
    {
      "category": "infrastructure_energy",
      "claim": "Dan says GPU server pricing is being driven more by demand than by memory cost inflation alone.",
      "confidence": "medium",
      "evidence": "He estimates memory added only 5-10% to average server cost while market price increases exceeded that, and he describes large AI labs signing 4-5 year, hundreds-of-megawatts off-take contracts.",
      "kind": "inference",
      "timestamp": "24:36"
    },
    {
      "category": "companies_capital_allocation",
      "claim": "The speakers say H100 useful-life assumptions are being revised upward by renewed long-term contracts.",
      "confidence": "medium",
      "evidence": "They report a neo cloud renewing an H100 contract for four more years, effectively committing payment through 2030 on GPUs first deployed years earlier.",
      "kind": "observation",
      "timestamp": "27:06"
    },
    {
      "category": "semiconductors_compute",
      "claim": "Dan says NVIDIA's CPO path appears to start with scale-out and inter-rack expansion rather than the originally expected scale-up-first path.",
      "confidence": "medium",
      "evidence": "He says CPO can remove pluggable optics and DSP energy, scale beyond copper's 2 meter reach, and that NVIDIA announcements such as NVO 576 and NVO 1152 connect racks with scale-up CPO.",
      "kind": "observation",
      "timestamp": "40:21"
    }
  ],
  "skip_reason": "",
  "summary": "The request metadata names a DG Matrix 800V DC episode, but the transcript is a different SemiAnalysis Weekly discussion about the AI silicon shortage. The transcript is still high-signal: speakers argue TSMC N3 wafer capacity is becoming the binding constraint, AI could consume most N3 output by 2027, HBM remains structurally tight, consumer-device weakness cannot release enough wafers, GPU rental economics support longer useful lives, and NVIDIA's CPO roadmap could reshape optical networking demand.",
  "why_it_matters": "The transcript gives concrete numbers for the next AI hardware bottleneck. It supports a view that leading-edge wafer allocation, HBM qualification, and long-duration GPU monetization may matter as much as data-center power in near-term AI infrastructure economics."
}
