{
  "changed_views": [
    "Nvidia's compute-financing push should be viewed as an attempt to finance the entire AI-factory supply chain, not merely as a mechanism for selling more GPUs.",
    "Carvana may have a structural application-layer AI advantage because it digitized a complex car transaction into separable, deterministic services before LLMs arrived.",
    "At Carvana, near-term AI leverage appears stronger in customer orchestration and workflow assistance than in fully autonomous physical reconditioning.",
    "Clair's growth suggests embedded distribution and an incumbent payroll provider's trust can matter more than a standalone fintech product experience."
  ],
  "entities": [
    "Nvidia",
    "Jensen Huang",
    "TSMC",
    "AI labs",
    "Carvana",
    "Ernie Garcia",
    "Clair",
    "Nico Simko",
    "CFTC",
    "Ian McGinley",
    "Kalshi"
  ],
  "follow_ups": [
    "Obtain the Nvidia financing vehicle's primary documents and quantify equity, debt, offtake, recourse, depreciation support, counterparties, and first deployments.",
    "Test Huang's AI-lab profitability and six-month startup-funding claims against lab disclosures, financing rounds, and committed compute spend.",
    "Track Carvana's deployed AI features and their measured effects on conversion, support resolution, reconditioning throughput, and unit costs.",
    "Reconcile Clair's $100 million revenue run-rate definition with audited revenue, take rate, credit losses, and payroll-partner concentration.",
    "Monitor the sports-event-contract appeals and the CFTC's proposed rule for manipulation, insider-trading, and consumer-protection requirements."
  ],
  "relevance_score": 5,
  "signals": [
    {
      "category": "infrastructure_energy",
      "claim": "Nvidia CEO Jensen Huang expects AI infrastructure to remain constrained across nearly every layer of the physical supply chain.",
      "confidence": "high",
      "evidence": "Huang names chips, memory, packaging, systems, photonics, connectors, land, power, and construction labor as simultaneous constraints and ties the pressure to AI beginning to perform productive work globally.",
      "kind": "forecast",
      "timestamp": "00:03:10"
    },
    {
      "category": "companies_capital_allocation",
      "claim": "Huang argues that profitable token economics and unprecedented startup funding can support institutional financing for AI-lab compute.",
      "confidence": "medium",
      "evidence": "He says AI labs and startups are among the fastest-growing technology companies, calls their tokens highly profitable, cites about $500 billion invested in AI startups over six months, and says the new vehicle gives them a way to finance compute.",
      "kind": "opinion",
      "timestamp": "00:04:28"
    },
    {
      "category": "applications_business_models",
      "claim": "Carvana CEO Ernie Garcia says the company's deterministic service architecture lets AI orchestrate a car purchase more completely than traditional dealers can.",
      "confidence": "medium",
      "evidence": "Garcia says financing, trade-in, warranty, insurance, contracts, and document verification were already separable digital services, allowing a natural-language system to combine them into complex answers without a human negotiating each economic term.",
      "kind": "inference",
      "timestamp": "01:08:33"
    },
    {
      "category": "applications_business_models",
      "claim": "Garcia expects used-car reconditioning to automate more slowly than new-car manufacturing because every incoming vehicle requires a different repair sequence.",
      "confidence": "high",
      "evidence": "He identifies reconditioning, including roughly $1,000 of parts and labor per car, as Carvana's main scalability constraint and expects repeatable tasks such as tire changes, inspection, and workflow guidance to automate before general-purpose physical repair.",
      "kind": "forecast",
      "timestamp": "01:05:31"
    },
    {
      "category": "companies_capital_allocation",
      "claim": "Garcia says Carvana's near-term investment case is operational scaling rather than a major new-product pivot.",
      "confidence": "high",
      "evidence": "He reports returns at roughly two to two-and-a-half times the industry norm, only 2% market share, and demand above current production capacity, then says the next five years of economic performance depend on making the existing machine incrementally better and larger.",
      "kind": "forecast",
      "timestamp": "01:03:11"
    },
    {
      "category": "applications_business_models",
      "claim": "Clair CEO Nico Simko says the failed standalone-bank product led to an embedded-payroll pivot that accelerated growth; the company separately announced a $100 million revenue run rate.",
      "confidence": "high",
      "evidence": "Simko says asking users to move their full financial lives made the original product fail; Clair instead embedded earned-wage access inside payroll providers whose brands and workforce apps employees already trusted, and he says growth accelerated after that shift.",
      "kind": "observation",
      "timestamp": "01:39:02; 01:42:44"
    },
    {
      "category": "policy_geopolitics_security",
      "claim": "Former CFTC enforcement chief Ian McGinley expects prediction-market regulation to tighten even though the markets themselves are likely permanent.",
      "confidence": "medium",
      "evidence": "McGinley says sports-contract jurisdiction has produced split district-court outcomes and one federal-preemption appellate ruling, predicts the dispute will reach the Supreme Court, and expects additional CFTC rules on manipulation and related risks.",
      "kind": "forecast",
      "timestamp": "01:46:37; 01:47:12; 01:57:53"
    }
  ],
  "skip_reason": "",
  "summary": "This wide-ranging TBPN episode contains unusually consequential first-party material from Nvidia CEO Jensen Huang on a compute-financing push, full-stack supply constraints, and AI-lab economics. Carvana CEO Ernie Garcia adds a concrete application-layer case: deterministic transaction services make customer-facing AI useful now, while heterogeneous physical reconditioning remains the harder automation bottleneck. Clair's embedded-payroll pivot and Ian McGinley's prediction-market regulatory outlook provide additional business-model and policy signal.",
  "why_it_matters": "The episode connects the AI capital cycle from institutional infrastructure finance down to real-world application adoption. Huang's comments sharpen the bull case but also expose its key dependency: financiers must accept aggressive claims about lab and token profitability while chips, power, land, and labor remain constrained. Carvana shows where legacy businesses with already-structured workflows can capture AI value, and where physical complexity still limits automation."
}
