{
  "changed_views": [
    "Independent inference and open-weight infrastructure may be scaling into a major standalone market faster than public model-share narratives imply.",
    "Small nuclear for AI has advanced from planned prototypes to reported electricity generation outside a national lab, although commercial NRC licensing remains ahead.",
    "Enterprise open-model adoption and frontier-model access should be modeled separately: substitution can accelerate even while regulation widens the capability gap.",
    "A government AI-lab equity stake carries competition and constitutional-governance implications, not just distributional effects."
  ],
  "entities": [
    "Together AI",
    "Vipul Ved Prakash",
    "Valar Atomics",
    "Isaiah Taylor",
    "Ward 250",
    "NVIDIA",
    "Baseten",
    "Tuhin Srivastava",
    "Dean Ball",
    "OpenAI"
  ],
  "follow_ups": [
    "Verify Together AI's bookings definition, revenue conversion, customer concentration, and Series B terms.",
    "Confirm Ward 250's electrical output, net-power status, operating duration, and Valar's NRC commercial-license timeline.",
    "Track whether US model export controls become an explicit licensing framework for frontier-capable open weights.",
    "Confirm Baseten's financing terms, valuation, compute commitments, and economics across its 20-cloud footprint."
  ],
  "relevance_score": 5,
  "signals": [
    {
      "category": "infrastructure_energy",
      "claim": "Valar Atomics founder Isaiah Taylor said the Ward 250 produced electricity for the first time, making Valar the first nuclear startup to generate electricity, and that the reactor powered an NVIDIA Spark.",
      "confidence": "high",
      "evidence": "Taylor said Valar progressed from a bare site after the May 2025 executive orders to criticality, thermal operation, and electricity production outside a national lab before its July 4 target; he also argued that one truckload of uranium can supply a year of fuel where gas projects face turbine and pipeline constraints.",
      "kind": "observation",
      "timestamp": "01:02:46"
    },
    {
      "category": "companies_capital_allocation",
      "claim": "Together AI CEO Vipul Ved Prakash said the company's bookings grew from $100 million to $1.2 billion within a year and that it raised an $800 million Series B.",
      "confidence": "high",
      "evidence": "Prakash tied the reported 12x bookings increase to serving open-weight models and powerful AI at materially lower cost.",
      "kind": "observation",
      "timestamp": "51:39"
    },
    {
      "category": "companies_capital_allocation",
      "claim": "Baseten co-founder Tuhin Srivastava said the company raised a $1.5 billion Series F and is building an inference cloud on compute rented from 20 clouds across 90 regions.",
      "confidence": "high",
      "evidence": "Srivastava described a platform spanning heterogeneous compute, inference and reinforcement-learning primitives, with routing and evaluation sandboxes planned, and said Baseten intends to move further down the stack to secure capacity.",
      "kind": "observation",
      "timestamp": "02:05:20"
    },
    {
      "category": "policy_geopolitics_security",
      "claim": "Dean Ball forecast that a US open-weight model reaching frontier-level capabilities would face a de facto licensing regime, and said enterprises should not assume open source will remain close to the American frontier.",
      "confidence": "medium",
      "evidence": "Ball estimated open models are roughly a year behind, saw safety, economic, and strategic headwinds, and said he would not be surprised if the gap widened over the next year.",
      "kind": "forecast",
      "timestamp": "01:11:42"
    },
    {
      "category": "policy_geopolitics_security",
      "claim": "Ball argued that a federal equity stake combined with operational influence could turn frontier labs into government instrumentalities or public utilities.",
      "confidence": "medium",
      "evidence": "He said a government balance-sheet interest could distort competition, while compelled content moderation or usage monitoring could expose private labs to constitutional due-process and speech obligations normally applied to government actors.",
      "kind": "inference",
      "timestamp": "01:11:42"
    },
    {
      "category": "applications_business_models",
      "claim": "Prakash said companies are rapidly substituting open models after closed-model prototypes become too expensive to scale in production, with data control becoming a second adoption driver.",
      "confidence": "medium",
      "evidence": "He reported that open models now handle long-horizon enterprise agent workloads, and said AI-native and digital-native customers increasingly benchmark and deploy them to lower cost and avoid teaching closed providers sensitive workflows.",
      "kind": "observation",
      "timestamp": "51:39"
    },
    {
      "category": "frontier_labs_models",
      "claim": "Prakash argued that distillation is an overstated explanation for open-model progress because effective on-policy distillation requires token-probability data that commercial APIs do not expose.",
      "confidence": "medium",
      "evidence": "He instead attributed much of the improvement to reinforcement learning plus standardized transformer architectures, training machinery, and tooling that let new labs start from proven systems.",
      "kind": "inference",
      "timestamp": "51:39"
    }
  ],
  "skip_reason": "",
  "summary": "TBPN assembled unusually dense first-party updates: Together AI reported 12x bookings growth and an $800 million round; Valar Atomics reported first electricity from its Ward 250 reactor; and Baseten reported a $1.5 billion round plus a 20-cloud inference footprint. The episode also exposed a material tension: open-model infrastructure executives see rapid enterprise substitution, while Dean Ball expects frontier-capable open weights to face de facto licensing and fall further behind closed models.",
  "why_it_matters": "The claims strengthen the case that independent inference and open-weight infrastructure are becoming major businesses, while Valar's milestone gives AI-focused nuclear deployment a concrete technical proof point. At the same time, model-access regulation is becoming a central dependency, and Ball's analysis suggests a federal equity stake in AI labs could create competition and constitutional-governance risks rather than merely distribute economic upside."
}
