{
  "changed_views": [
    "A predeployment-only safety regime may be structurally mismatched to models that keep updating after release.",
    "Continual learning could supply frontier labs with the usage flywheel and customer switching costs that current interchangeable model APIs lack.",
    "Personalized weight forks may favor large enterprises rather than individuals because inference batching efficiency depends on many concurrent sequences sharing the same weights."
  ],
  "entities": [
    "Dwarkesh Patel",
    "Anthropic",
    "Mythos",
    "DeepSeek V3",
    "Codex",
    "Claude Code",
    "Google"
  ],
  "follow_ups": [
    "Track which frontier labs demonstrate durable weight updates from deployment rather than session memory or retrieval alone.",
    "Watch for continual-learning safety evaluations covering weight drift, cross-user poisoning, and retention of alignment properties.",
    "Stress-test the claimed DeepSeek V3 batch-size and 100x-plus batch-one penalty under low-rank adapters, sparse routing, and realistic enterprise traffic."
  ],
  "relevance_score": 4,
  "signals": [
    {
      "category": "policy_geopolitics_security",
      "claim": "Patel argues that continual weight updates would make one-time predeployment safety evaluations obsolete and favors recurring monthly or quarterly risk inspections instead.",
      "confidence": "medium",
      "evidence": "He reasons that a base model updated daily from millions of work sessions would erase the clean training-versus-deployment boundary assumed by static certification regimes.",
      "kind": "forecast",
      "timestamp": ""
    },
    {
      "category": "frontier_labs_models",
      "claim": "Patel says current alignment techniques are poorly matched to models whose weights keep changing during deployment.",
      "confidence": "medium",
      "evidence": "He highlights unresolved risks including jailbreak susceptibility, persona drift, and users injecting backdoors or malicious tendencies into a model that consolidates learning across sessions.",
      "kind": "opinion",
      "timestamp": ""
    },
    {
      "category": "frontier_labs_models",
      "claim": "Patel predicts continual learning would turn a frontier-model lead into a deployment-data flywheel.",
      "confidence": "medium",
      "evidence": "His mechanism is that the best model attracts more difficult real-world work and feedback, incorporates that experience, improves further, and then attracts still more valuable usage.",
      "kind": "forecast",
      "timestamp": ""
    },
    {
      "category": "companies_capital_allocation",
      "claim": "Patel expects labs to release their strongest models earlier because an internal-only period would forfeit valuable deployment learning.",
      "confidence": "medium",
      "evidence": "He cites Anthropic using Mythos internally from February before a June public release and argues that a four-month gap would become a competitive learning disadvantage.",
      "kind": "inference",
      "timestamp": ""
    },
    {
      "category": "applications_business_models",
      "claim": "Patel predicts organization-specific continual learning would create substantial switching costs and give leading model providers a durable margin moat.",
      "confidence": "medium",
      "evidence": "He compares changing providers after months of accumulated organizational learning to firing an experienced employee and retraining a new one from scratch.",
      "kind": "forecast",
      "timestamp": ""
    },
    {
      "category": "applications_business_models",
      "claim": "Patel expects labs to use pricing and model access to obtain rights to learn from economically valuable enterprise sessions.",
      "confidence": "low",
      "evidence": "He suggests providers could subsidize customers that permit training while withholding their best models from enterprises that refuse, although merging user-specific weight forks remains technically harder.",
      "kind": "forecast",
      "timestamp": ""
    },
    {
      "category": "semiconductors_compute",
      "claim": "Patel argues that full-weight personalization could make continual-learning inference far more economical for large organizations than for individuals.",
      "confidence": "medium",
      "evidence": "His back-of-the-envelope estimate puts DeepSeek V3's efficient sparse-model batch above 2,400 concurrent sequences and suggests batch-one personalized serving could incur a compute-efficiency penalty exceeding 100x.",
      "kind": "inference",
      "timestamp": ""
    }
  ],
  "skip_reason": "",
  "summary": "Patel argues that continual weight updates would collapse the boundary between training and deployment, forcing changes in safety evaluation, release strategy, competitive dynamics, enterprise data rights, and inference economics. The essay is a scenario analysis rather than evidence that continual learning already works, but it identifies several concrete mechanisms by which it could reshape frontier-lab moats.",
  "why_it_matters": "If deployment experience can be consolidated into model weights, real-world usage becomes both a training asset and a source of compounding advantage. That could favor early-shipping labs, create organization-specific switching costs, weaken static safety certification, and make efficiently served shared weights more valuable than isolated personalized models."
}
